<?xml version="1.0"?>
<License xmlns:xsi="http://www.w3.org/2001/XMLSchema-instance" xmlns="urn:spdx-xml:1.0" xsi:schemaLocation="urn:spdx-xml:1.0 ../xsd/spdx-license-iep.xsd">
  <LicenseID>Test string one</LicenseID>
  <CommentText>Test string one</CommentText>
  <SeeAlsoURI>http://anyuri.org</SeeAlsoURI>
  <Name>Test string one</Name>
  <IsDeprecatedLicenseID>true</IsDeprecatedLicenseID>
  <IsOsiApprovedIndicator>true</IsOsiApprovedIndicator>
  <IsFsfLibreIndicator>true</IsFsfLibreIndicator>
  <StandardLicenseHeaderText>Test string one</StandardLicenseHeaderText>
  <LicenseText>Test string one</LicenseText>
  <StandardLicenseTemplateText>Test string one</StandardLicenseTemplateText>
</License>
